{
  "assets_manifest_path": "assets-manifest.json",
  "corpus_id": "ui-reference-events.v2",
  "fixtures": [
    {
      "schema_version": "ui-reference-event.v2",
      "fixture_id": "event.real.2182",
      "event_id": 2182,
      "source_prod_id": 2182,
      "slug": "peschanaya-palitra-kurshskoy-kosy-kaliningrad-2182",
      "source_repository_sha": "8710e56fa3685f6c30a90cd062d532dce0348cce",
      "source_static_build_id": "golden-event-corpus-v2-20260829",
      "source_snapshot": {
        "kind": "preview-export-catalog-revision",
        "sha256": "6668f5a6f22f6c9a4e1f28af242e77bedb81eab1d06a37ba1227c8898133f409"
      },
      "extracted_at": "2026-08-29T12:50:30.251434+00:00",
      "preview_event_sha256": "421b186617e8c9eb3ed874b17d6f319f94508babc1022542f81ea608127d5f25",
      "payload_path": "events/event.real.2182.json",
      "coverage_tags": [
        "active-september",
        "landscape-crop-safe",
        "visual-only",
        "single-image",
        "admission-free"
      ]
    },
    {
      "schema_version": "ui-reference-event.v2",
      "fixture_id": "event.real.6711",
      "event_id": 6711,
      "source_prod_id": 6711,
      "slug": "vystavka-pod-shum-baltiyskogo-vetra-svetlogorsk-6711",
      "source_repository_sha": "8710e56fa3685f6c30a90cd062d532dce0348cce",
      "source_static_build_id": "golden-event-corpus-v2-20260829",
      "source_snapshot": {
        "kind": "preview-export-catalog-revision",
        "sha256": "6668f5a6f22f6c9a4e1f28af242e77bedb81eab1d06a37ba1227c8898133f409"
      },
      "extracted_at": "2026-08-29T12:50:30.251434+00:00",
      "preview_event_sha256": "a54d8c4388335a0c4125467d001062775027e48c663e06cacab591a225947d8b",
      "payload_path": "events/event.real.6711.json",
      "coverage_tags": [
        "active-september",
        "four-three-visual",
        "landscape-crop-safe",
        "visual-only",
        "multi-image",
        "admission-free"
      ]
    },
    {
      "schema_version": "ui-reference-event.v2",
      "fixture_id": "event.real.7609",
      "event_id": 7609,
      "source_prod_id": 7609,
      "slug": "vystavka-zhivaya-nit-traditsiy-sovetsk-7609",
      "source_repository_sha": "8710e56fa3685f6c30a90cd062d532dce0348cce",
      "source_static_build_id": "golden-event-corpus-v2-20260829",
      "source_snapshot": {
        "kind": "preview-export-catalog-revision",
        "sha256": "6668f5a6f22f6c9a4e1f28af242e77bedb81eab1d06a37ba1227c8898133f409"
      },
      "extracted_at": "2026-08-29T12:50:30.251434+00:00",
      "preview_event_sha256": "4603ed79e730952f6e37503db096988aac9fd2f5923b7008daa4900c4fafb692",
      "payload_path": "events/event.real.7609.json",
      "coverage_tags": [
        "active-september",
        "square-poster",
        "ocr-protected",
        "multi-image",
        "admission-free"
      ]
    },
    {
      "schema_version": "ui-reference-event.v2",
      "fixture_id": "event.real.8006",
      "event_id": 8006,
      "source_prod_id": 8006,
      "slug": "donorskaya-aktsiya-stan-donorom-krovi-gurevsk-8006",
      "source_repository_sha": "8710e56fa3685f6c30a90cd062d532dce0348cce",
      "source_static_build_id": "golden-event-corpus-v2-20260829",
      "source_snapshot": {
        "kind": "preview-export-catalog-revision",
        "sha256": "6668f5a6f22f6c9a4e1f28af242e77bedb81eab1d06a37ba1227c8898133f409"
      },
      "extracted_at": "2026-08-29T12:50:30.251434+00:00",
      "preview_event_sha256": "ad1a836f259ed7c744ab1a314ea7a0d6924de1f0b6539cebaea3cc30ca39a403",
      "payload_path": "events/event.real.8006.json",
      "coverage_tags": [
        "early-september",
        "portrait-poster",
        "ocr-protected",
        "single-image",
        "admission-free"
      ]
    },
    {
      "schema_version": "ui-reference-event.v2",
      "fixture_id": "event.real.8200",
      "event_id": 8200,
      "source_prod_id": 8200,
      "slug": "muzykalnaya-ekspeditsiya-borisa-andrianova-hrabrovo-8200",
      "source_repository_sha": "8710e56fa3685f6c30a90cd062d532dce0348cce",
      "source_static_build_id": "golden-event-corpus-v2-20260829",
      "source_snapshot": {
        "kind": "preview-export-catalog-revision",
        "sha256": "6668f5a6f22f6c9a4e1f28af242e77bedb81eab1d06a37ba1227c8898133f409"
      },
      "extracted_at": "2026-08-29T12:50:30.251434+00:00",
      "preview_event_sha256": "010b899a479ce9459becda0107791d848b65946e077e5586e67ad2ac25ac5078",
      "payload_path": "events/event.real.8200.json",
      "coverage_tags": [
        "early-september",
        "program-document",
        "six-seven-poster",
        "ocr-protected",
        "single-image",
        "admission-free"
      ]
    },
    {
      "schema_version": "ui-reference-event.v2",
      "fixture_id": "event.real.7907",
      "event_id": 7907,
      "source_prod_id": 7907,
      "slug": "rybatskaya-derevnya-na-krayu-zemli-kaliningrad-7907",
      "source_repository_sha": "8710e56fa3685f6c30a90cd062d532dce0348cce",
      "source_static_build_id": "golden-event-corpus-v2-20260829",
      "source_snapshot": {
        "kind": "preview-export-catalog-revision",
        "sha256": "6668f5a6f22f6c9a4e1f28af242e77bedb81eab1d06a37ba1227c8898133f409"
      },
      "extracted_at": "2026-08-29T12:50:30.251434+00:00",
      "preview_event_sha256": "af19354e1aa89ab505d9bbe57a7652950b3059fd3c5372822e9b9902dfd22ea9",
      "payload_path": "events/event.real.7907.json",
      "coverage_tags": [
        "active-september",
        "landscape-document",
        "ocr-protected",
        "multi-image",
        "mixed-ocr-visual",
        "admission-free",
        "long-title"
      ]
    },
    {
      "schema_version": "ui-reference-event.v2",
      "fixture_id": "event.real.6942",
      "event_id": 6942,
      "source_prod_id": 6942,
      "slug": "stendap-udobnyy-kaliningrad-6942",
      "source_repository_sha": "8710e56fa3685f6c30a90cd062d532dce0348cce",
      "source_static_build_id": "golden-event-corpus-v2-20260829",
      "source_snapshot": {
        "kind": "preview-export-catalog-revision",
        "sha256": "6668f5a6f22f6c9a4e1f28af242e77bedb81eab1d06a37ba1227c8898133f409"
      },
      "extracted_at": "2026-08-29T12:50:30.251434+00:00",
      "preview_event_sha256": "8a89513dd27bdf038a5aab6ce84c0f1d1ba6d65e848b7c18ba8d49361227a1cb",
      "payload_path": "events/event.real.6942.json",
      "coverage_tags": [
        "mid-september",
        "four-five-poster",
        "ocr-protected",
        "legacy-cdn-bundled",
        "admission-price"
      ]
    },
    {
      "schema_version": "ui-reference-event.v2",
      "fixture_id": "event.real.7020",
      "event_id": 7020,
      "source_prod_id": 7020,
      "slug": "orfey-i-evridika-kaliningrad-7020",
      "source_repository_sha": "8710e56fa3685f6c30a90cd062d532dce0348cce",
      "source_static_build_id": "golden-event-corpus-v2-20260829",
      "source_snapshot": {
        "kind": "preview-export-catalog-revision",
        "sha256": "6668f5a6f22f6c9a4e1f28af242e77bedb81eab1d06a37ba1227c8898133f409"
      },
      "extracted_at": "2026-08-29T12:50:30.251434+00:00",
      "preview_event_sha256": "becb9083c46643124148166b3b3ac1b7c5dc0540d7e9d123b1419cb52cefebdf",
      "payload_path": "events/event.real.7020.json",
      "coverage_tags": [
        "late-september",
        "portrait-poster",
        "ocr-protected",
        "multi-image",
        "mixed-media-gallery",
        "admission-price"
      ]
    }
  ],
  "immutable": true,
  "purpose": "cross-surface-event-card-visual-diagnostics",
  "reference_clock": {
    "current_date": "2026-08-29",
    "reference_iso": "2026-08-29T14:00:00+02:00",
    "timezone": "Europe/Kaliningrad"
  },
  "projection_paths": [
    "projections/free-collection-september.v1.json"
  ],
  "schema_version": "ui-reference-event-corpus.v2",
  "source": {
    "repository": "onedayonemasterpiece/events-bot-new",
    "repository_sha": "8710e56fa3685f6c30a90cd062d532dce0348cce",
    "static_build_id": "golden-event-corpus-v2-20260829",
    "snapshot": {
      "kind": "preview-export-catalog-revision",
      "sha256": "6668f5a6f22f6c9a4e1f28af242e77bedb81eab1d06a37ba1227c8898133f409",
      "scope": "bounded-production-slice"
    },
    "preview_export_sha256": "7e4ea8f4a6c6273e17d5531ca009b4dfaf184a2328f45832e41b308bfe170032",
    "preview_contract": "PreviewEvent"
  },
  "surface_expectations_path": "surface-expectations.json",
  "version": "v2",
  "corpus_sha256": "b1746f0cd68be6dd6060858fb765c6863535aefbcf4844b9b50c279d69e9306a"
}
